{
  "schemaVersion": 1,
  "recordType": "state",
  "rulesetVersion": "1.0.0",
  "recordRevision": 1,
  "owner": {
    "accountId": "1001",
    "profileRepositoryId": "9001"
  },
  "faction": {
    "id": "bloomguard",
    "confirmedAt": "2026-10-15T00:50:00Z"
  },
  "growth": {
    "phase": "ready",
    "startDate": "2026-07-17",
    "totalXp": "0"
  },
  "class": {
    "id": "adventurer",
    "lastChangedOn": null,
    "pending": null,
    "history": []
  },
  "traits": {
    "habit": {
      "currentId": null,
      "pending": null
    },
    "activity": {
      "currentId": null,
      "pending": null
    }
  },
  "observationClock": {
    "lastNormalEvaluationOn": "2026-10-15",
    "classLastCountedOn": null,
    "habitLastCountedOn": null,
    "activityLastCountedOn": null
  },
  "achievements": [],
  "settings": {
    "filePreviouslyUsed": true,
    "lastAcceptedHash": "v1:sha256:17a7a06e59bc623ee72dc24c262bc49906d70c731237f769fcf76d754829674e"
  },
  "evaluation": {
    "lastSuccessfulRevision": 1,
    "evaluatedAt": "2026-10-15T01:00:00Z",
    "activityCutoffExclusive": "2026-10-15",
    "scopeId": "v1:sha256:257e426948e4e1f64508bf9f9c9244583badf46c8cee1bd42a94b6095470b709"
  },
  "integrity": {
    "ledgerHash": "v1:sha256:4bea0637f97aab740e2c9f5d7e09617cf09549862ec205663d00552cda742d77"
  }
}
