{
  "schemaVersion": 1,
  "recordType": "state",
  "rulesetVersion": "1.0.0",
  "recordRevision": 1,
  "owner": {
    "accountId": "1001",
    "profileRepositoryId": "9001"
  },
  "faction": {
    "id": "bloomguard",
    "confirmedAt": "2026-10-15T00:50:00Z"
  },
  "growth": {
    "phase": "ready",
    "startDate": "2026-07-17",
    "totalXp": "100"
  },
  "class": {
    "id": "adventurer",
    "lastChangedOn": null,
    "pending": null,
    "history": []
  },
  "traits": {
    "habit": {
      "currentId": null,
      "pending": null
    },
    "activity": {
      "currentId": null,
      "pending": null
    }
  },
  "observationClock": {
    "lastNormalEvaluationOn": "2026-10-15",
    "classLastCountedOn": null,
    "habitLastCountedOn": null,
    "activityLastCountedOn": null
  },
  "achievements": [
    {
      "seriesId": "completed-works",
      "earned": [
        {
          "grade": "bronze",
          "earnedAt": "2026-10-15T01:00:00Z"
        }
      ]
    },
    {
      "seriesId": "allys-shield",
      "earned": [
        {
          "grade": "bronze",
          "earnedAt": "2026-10-15T01:00:00Z"
        }
      ]
    },
    {
      "seriesId": "launch-bell",
      "earned": [
        {
          "grade": "bronze",
          "earnedAt": "2026-10-15T01:00:00Z"
        }
      ]
    }
  ],
  "settings": {
    "filePreviouslyUsed": true,
    "lastAcceptedHash": "v1:sha256:17a7a06e59bc623ee72dc24c262bc49906d70c731237f769fcf76d754829674e"
  },
  "evaluation": {
    "lastSuccessfulRevision": 1,
    "evaluatedAt": "2026-10-15T01:00:00Z",
    "activityCutoffExclusive": "2026-10-15",
    "scopeId": "v1:sha256:57ef5775ba19f381c51f53fea413c885364935ea361c6f959d522197c9fd7c1b"
  },
  "integrity": {
    "ledgerHash": "v1:sha256:21a7704ba557dd18beb82378fe26cff21c6c12e1a1f4320d9d2c39b1b87142e9"
  }
}
